sentence,percentage,type,is_high_risk
"Sales and Marketing We have a diverse customer base, with our top customer representing 13.3% of consolidated 2024 revenue.",13.3%,customer,True
Our largest customer can change from year to year.,,customer,True
"Although we have7/1/25, 9:07 PM Comfort Systems USA, Inc._December 31, 2024 https://www.sec.gov/Archives/edgar/data/1035983/000155837025001222/ﬁx-20241231x10k.htm 22/159 Table of Contents long - standing relationships with many of our significant customers and believe that our portfolio of customers is reasonably diverse, one or a number of significant customers may unilaterally reduce, fail to renew, or terminate their contracts with us in the future.",,customer,True
"A loss of business from a significant customer, or a number of significant customers, could have a material adverse effect on our business, financial condition, results of operations and cash flows.",,customer,True
We hire third-party subcontractors to perform work and depend on third-party suppliers to provide equipment and materials necessary to complete our projects.,,supplier,True
"Information technology system failures, including suppliers’ or vendors’ system failures, could disrupt our operations by causing transaction errors, processing inefficiencies, the loss of customers, other business disruptions or the loss of employee or other third-party personal information.",,supplier,True
"These events could impact our customers, employees and reputation and lead to financial losses from remediation actions, loss of business or access to our business data, potential liability or an increase in expenses, all of which may have a material adverse effect on our business.",,customer,True
"We have a diverse customer base, with our top customer representing 13.3% of consolidated 2024 revenue and 17.7% of total receivables as of December 31, 2024.7/1/25, 9:07 PM Comfort Systems USA, Inc._December 31, 2024 https://www.sec.gov/Archives/edgar/data/1035983/000155837025001222/ﬁx-20241231x10k.htm 99/159 Table of Contents Financial Instruments Our financial instruments consist of cash and cash equivalents, accounts receivable, other receivables, accounts payable and life insurance policies, for which we deem the carrying values approximate their fair values due to the short-term nature of these instruments, as well as notes to former owners and a revolving credit facility.",13.3%,customer,True
